direction,code,description
02.04.03,ОПК-3,"владением теоретическими основами информатики как науки; знание проблем современной информатики, ее категории и связи с другими научными дисциплинами, понимание основных этапов и тенденции развития программирования, математического обеспечения и информационных, технологий"
02.04.03,ОПК-4,"владением основными методами и средствами автоматизации проектирования, производства, испытаний и оценки качества программного обеспечения"
02.04.03,ОПК-5,"владением основными концептуальными положениями функционального, рекурсивного, логического, объектно-ориентированного и визуального направлений программирования, методами и средствами разработки программ в рамках этих направлений"
02.04.03,ОПК-6,"владением архитектурой, алгоритмами функционирования систем реального времени и методами проектирования их программного обеспечения"
02.04.03,ОПК-7,"владением навыками использования современных системных программных средств: операционных систем, операционных и сетевых оболочек, сервисных программ"
02.04.03,ОПК-8,владением навыками разработки моделирующих алгоритмов и реализации их на базе языков и пакетов прикладных программ моделирования
02.04.03,ОПК-9,владением навыками использования основных моделей информационных технологий и способов их применения для решения задач в предметных областях
02.04.03,ОПК-10,"владением навыками выбора архитектуры и комплексирования современных компьютеров, систем, комплексов и сетей системного администрирования"
02.04.03,ОПК-11,"владением навыками выбора, проектирования, реализации, оценки качества и анализа эффективности программного обеспечения для решения задач в различных предметных областях"
02.04.03,ПК-1,владением навыками использования метода системного моделирования при исследовании и проектировании систем
02.04.03,ПК-2,"готовностью применять современные методы проектирования и производства программного продукта, принципы построения, структуры и приемы работы с инструментальными средствами, поддерживающими создание программного обеспечения"
02.04.03,ПК-3,"готовностью организовать работу в коллективе разработчиков программного обеспечения, на основе современных направлений развития методов и программных средств коллективной разработки программного обеспечения"
02.04.03,ПК-4,способностью понимать проблемы и оценивать тенденции развития рынка программного обеспечения
02.04.03,ПК-5,"готовностью воспринимать и проводить анализ направлений развития компьютеров с традиционной (нетрадиционной) архитектурой, воспринимать тенденции развития функций и архитектур проблемно-ориентированных программных систем и комплексов (ПК 6); владением принципами обеспечения условий безопасности и жизнедеятельности при разработке и эксплуатации аппаратуры и систем различного назначения"
02.04.03,ПК-7,владением навыками преподавания компьютерных наук
02.04.03,ПК-8,владением навыками разработки методических материалов для преподавания компьютерных наук
